,tokens
503,rt michaelbabad a day of reckon is come for justin trudeau s liber govern cibc subscrib http t co rrjgoeuyqi http
504,a day of reckon is come for trudeau liber govern cibc cdnpoli http t co mzazin2zlk
505,rt calxandr could not agre more day of reckon is come for justin trudeau s liber govern cibc via globeandmail http
506,could not agre more day of reckon is come for justin trudeau s liber govern cibc via http t co uybd96kjic
507,thedave2006 cibc lower target to 15
508,skywork solut swk receiv market perform rate from cibc http t co dhzvk2plrv
509,skywork solut swk market perform rate reiter at cibc http t co 6riazzyaad
510,searchlight news cibc fcib make donat to melisizw brother concert in svg http t co 2un7sfqidk stvincent grenadin
511,a day of reckon is come for justin trudeau s liber govern cibc http t co rlnsj7rczo
512,click to read the latest cibc wood gundi isg daili market beat http t co ccyltdstqw
513,a new cibc poll find pay down debt is the number 1 financi prioriti for canadian head into 2019 the nint http t co aakb7d4hj3
514,cibc would rather see you push a canadian destin natur canada buyloc
515,rt dbcurren cibc canada s trade deficit continu to slide wider in nov and unlik last month the detail didn t provid an offset to
516,more from cibc on canada trade data export show weak outsid of just soft oil price non energi export http t co ay2jlmhq2
517,rt dbcurren cibc canada s trade deficit continu to slide wider in nov and unlik last month the detail didn t provid an offset to
518,cibc canada s trade deficit continu to slide wider in nov and unlik last month the detail didn t provid an http t co 5jfg3rxkch
519,a day of reckon is come for justin trudeau s liber govern cibc via globeandmail http t co pnuo1pcmmb
520,jean gauthier manag director amp cio global fix incom at cibc asset manag discu interest rate mon http t co zzkegkfbec
521,the bank of canada will be make it latest interest rate decis wednesday with the likelihood of a hold steadi http t co pzyfju8myd
522,a new year is a new opportun for you to start plot your futur with a land loan call u today http t co q5c9byxq6c
523,click to read the latest cibc wood gundi isg daili market beat http t co od5ebgdrwq
524,rt waterlooeng while it s onli the second day back to class co op employ info session start today with session from cibc capit
525,a new year is a new opportun for you to start plot your futur with a land loan call u today http t co auuoiqgslp
526,rt waterlooeng while it s onli the second day back to class co op employ info session start today with session from cibc capit
527,while it s onli the second day back to class co op employ info session start today with session from cibc c http t co afkde77jkn
528,ipnigh we re take the necessari step to shut down the fraudul site thank for reach out jenn
529,ndnopi hi davey we appreci your feedback anytim we make the difficult decis to close one of our bank http t co vanvvpq2s
530,rt totemranch613 a day of reckon is come for justin trudeau s liber govern cibc http t co bdqc77p1iw via newsnowuk
531,aworldtraveler_ good day notic your tweet we d like to help pleas send u a dm with more detail so that we can assist am
532,well thi is someth you just don t hear everyday from a charter canadian bank a day of reckon is come fo http t co 6psyzxadha
533,the bank of canada will be make it latest interest rate decis wednesday with the likelihood of a hold steadi http t co zcrpb1ecdq
534,rt michaelbabad a day of reckon is come for justin trudeau s liber govern cibc subscrib http t co rrjgoeuyqi http
535,too bad about the headlin the reckon come for the liber is on what cibc see a a good record and i http t co xgorldpcjj
536,financialpost 1 we prove ontliber are corrupt 2 we prove lawsocietylso is corrupt 3 we prove http t co wetlmyvgzc
537,a day of reckon is come for justin trudeau s liber govern cibc http t co bdqc77p1iw via newsnowuk
538,rt michaelbabad a day of reckon is come for justin trudeau s liber govern cibc subscrib http t co rrjgoeuyqi http
539,a day of reckon is come for justin trudeau s liber govern cibc subscrib http t co rrjgoeuyqi http t co k111rgpget
540,a day of reckon is come for justin trudeau s liber govern cibc http t co re3rrxx7tf
541,cibc initi coverag on catalyst bioscienc cbio john perri zolmax http t co qz4waksyjl
542,cibc initi coverag on catalyst bioscienc cbio http t co i2bpdxe0fb
543,cibc initi coverag on catalyst bioscienc cbio http t co syowridtfw
544,rt wahlbergyouth it s been two week sinc cibcmiracleday 2018 grate to our friend who join u the organ we support w t
545,cibc just not their economi
547,rt dorkdragoon dear cibc i don t realli know much about your compani but your advertis with the penguin wa enjoy to watch
548,dear cibc i don t realli know much about your compani but your advertis with the penguin wa enjoy t http t co dioqsbmho1
549,rt specincanada remind that specialistern is recruit for role with cibc do you identifi a someon on the autism spectrum or wit
551,divvydad 3 at cibc if you happen to be canadian there are certainli some upsid to the uptick in interest rate
552,love the comfi chair cibc provid for pearson intern arriv peep thank you greatadvertis http t co lpqoch13pt
553,the bank of canada will be make it latest interest rate decis wednesday with the likelihood of a hold steadi http t co 2yk1zxh5cq
554,cibc our branch close it door in our commun becaus it no longer want to do busi with first nation af http t co u9auzvthya
555,rt n0p1shing bank phish opendir hxxp 111 90 150 44 1 bank kit for cibc cibc zip actor email js7676027 gmail com nullcooki
556,hamilton cibc theatr http t co 690zohpa0j
557,rt nhlblackhawk stay warm never look so cool thank to cibc the first 10 000 fan at tonight s game will take home thi blackh
558,rt nhlblackhawk stay warm never look so cool thank to cibc the first 10 000 fan at tonight s game will take home thi blackh
559,rt cbunivers thi week in the verschuren centr rbc cibc and td_canada will be on site to assist newli arriv student with their
560,rt nhlblackhawk stay warm never look so cool thank to cibc the first 10 000 fan at tonight s game will take home thi blackh
561,rt nhlblackhawk stay warm never look so cool thank to cibc the first 10 000 fan at tonight s game will take home thi blackh
562,rt nhlblackhawk stay warm never look so cool thank to cibc the first 10 000 fan at tonight s game will take home thi blackh
563,cibc asset manag ha lift by 557384 it baytex energi bte hold simul plu http t co bffan7xj3n
564,rt cibcfcibjm is thi your first time appli for a credit card cibc firstcaribbean s cash back visa credit card is the smart choic fo
565,rt cibcfcibbb is thi your first time appli for a credit card cibc firstcaribbean s cash back visa credit card is the smart choic fo
566,ipnigh hi there thank you for bring thi to our attent i can confirm that thi e mail wa not sent by cibc http t co t3jgufgk6j
568,suspect arrest shortli after bank robberi in nanaimo polic say one man wa arrest after allegedli rob the http t co sxrv34kgjh
569,rt aaroncheddi motivationmonday http t co 8iynoal6jv
570,rachana05647650 hi rachana05647650 my name is matthew halickman and i am also in educ 307 just want to reach http t co h9p5tcl935
571,rt nhlblackhawk stay warm never look so cool thank to cibc the first 10 000 fan at tonight s game will take home thi blackh
572,rt nhlblackhawk stay warm never look so cool thank to cibc the first 10 000 fan at tonight s game will take home thi blackh
573,rt nhlblackhawk stay warm never look so cool thank to cibc the first 10 000 fan at tonight s game will take home thi blackh
574,cibc what a funni thing to say in 2012 at 92 yr paulin wa look for an advisor from cibc regard the 17 http t co ccc7ac4m6z
575,what a funni thing to say in 2012 at 92 yr paulin wa look for an advisor from cibc regard the 17000 00 http t co fcjdrejwtg
576,rt nhlblackhawk stay warm never look so cool thank to cibc the first 10 000 fan at tonight s game will take home thi blackh
577,what a funni thing to say in 2012 at 92 yr paulin wa look for an advisor from cibc regard the 17000 00 http t co xsie7lzpmw
578,rt nhlblackhawk stay warm never look so cool thank to cibc the first 10 000 fan at tonight s game will take home thi blackh
579,rt nhlblackhawk stay warm never look so cool thank to cibc the first 10 000 fan at tonight s game will take home thi blackh
580,rt nhlblackhawk stay warm never look so cool thank to cibc the first 10 000 fan at tonight s game will take home thi blackh
581,rt nhlblackhawk stay warm never look so cool thank to cibc the first 10 000 fan at tonight s game will take home thi blackh
582,rt nhlblackhawk stay warm never look so cool thank to cibc the first 10 000 fan at tonight s game will take home thi blackh
583,rt nhlblackhawk stay warm never look so cool thank to cibc the first 10 000 fan at tonight s game will take home thi blackh
584,rt nhlblackhawk stay warm never look so cool thank to cibc the first 10 000 fan at tonight s game will take home thi blackh
585,rt nhlblackhawk stay warm never look so cool thank to cibc the first 10 000 fan at tonight s game will take home thi blackh
586,rt nhlblackhawk stay warm never look so cool thank to cibc the first 10 000 fan at tonight s game will take home thi blackh
587,rt nhlblackhawk stay warm never look so cool thank to cibc the first 10 000 fan at tonight s game will take home thi blackh
588,rt nhlblackhawk stay warm never look so cool thank to cibc the first 10 000 fan at tonight s game will take home thi blackh
589,rt nhlblackhawk stay warm never look so cool thank to cibc the first 10 000 fan at tonight s game will take home thi blackh
590,rt nhlblackhawk stay warm never look so cool thank to cibc the first 10 000 fan at tonight s game will take home thi blackh
591,stay warm never look so cool thank to cibc the first 10 000 fan at tonight s game will take home thi http t co 3aspu3xqd
592,a decemb poll conduct by cibc found that for the ninth year in a row pay down debt is the no 1 prioriti http t co dddywbppi
593,the data vizart student challeng dva is offici open tellitwithdata for your chanc to win 3000 sponsor http t co oiytngcj8
594,rt waterlooeng mark your calendar the second annual data vizart student challeng present by tableau cibc and deloitt ha open today
596,the bank of canada will be make it latest interest rate decis wednesday with the likelihood of a hold steadi http t co iesmajcvqk
597,mark your calendar the second annual data vizart student challeng present by tableau cibc and deloitt ha ope http t co luadvelexd
598,rt agontario thank to our mani sponsor ainley group bmo cathi hunt cpa conestogo agri system holmesagro nation bank of can
599,thank to our mani sponsor ainley group bmo cathi hunt cpa conestogo agri system holmesagro nation ba http t co 2hedlvhjho
600,failb8 hi jake our no fee daili bank refer to no monthli fee with no minimum balanc unlimit debit purcha http t co qjluskssbz
601,bmo hey whi exactli have i been on hold for 45 minut becaus my password won t work on your onlin bank for http t co jbzopn98h7
602,faridasomje hi farida i can confirm the bank centr leader ha attempt to reach out to you to discu thi http t co fk4kzhiwq9
603,ki5e4 thank for your feedback maria we appreci you take the time to show love to our penguin have a great day rahul
604,boc s first polici rate announc of the year is schedul for wednesday will interest rate rise unlik thi http t co qegwdlizci
605,such a great idea cibc activ their partnership with torontopearson and ohlhockey with bubbl hockey at bagg http t co 1n8nwkwl6g
606,cibc man i love the cibc penguin
607,don t miss cibc linkedin and googl at their uwaterloo info session tomorrow regist here http t co glipqjcneg
608,rt leftytrad thuuur she go apha anon and cibc http t co 41gh8ckf1c
609,rt vibrantcalgari canadian say pay down debt is their top financi prioriti in 2019 cibc poll poverti debt financ http t c
610,cibc here we go again one teller at the bank like i say no matter what time cibc cibcportcoquitlam portcoquitlam
612,jean gauthier manag director amp cio global fix incom at cibc asset manag discu interest rate mon http t co 9x37t5cwli
614,when cibc bless u with 300 http t co ag8vbafv3k
615,canadian say pay down debt is their top financi prioriti in 2019 cibc poll poverti debt financ http t co vjnalalp6g
616,erika_lee_ hi again erik just follow up to see if you were abl to reach u by phone if not would you mind http t co 8ropxptzml
617,rt canadiancharte2 with home sale fall and price still high the hous market is far from stabil say cibc deputi chief econ
618,with home sale fall and price still high the hous market is far from stabil say cibc deputi chief e http t co lsrfmtspe7
619,rt specincanada remind that specialistern is recruit for role with cibc do you identifi a someon on the autism spectrum or wit
620,rt specincanada remind that specialistern is recruit for role with cibc do you identifi a someon on the autism spectrum or wit
621,rt leftytrad thuuur she go apha anon and cibc http t co 41gh8ckf1c
622,aworldtraveler_ cibc_fcib over to you
623,thuuur she go apha anon and cibc http t co 41gh8ckf1c
624,click to read the latest cibc wood gundi isg daili market beat http t co ct3socvmwt
625,king_deem everyon said cibc wa the wave too
626,rt ljkawa veri veri good stuff from cibc s ian pollick on the implic of the shift in the carri curv in canadaland http t co 67i
627,veri veri good stuff from cibc s ian pollick on the implic of the shift in the carri curv in canadaland http t co 67iytlmccd
629,clearlythuydoan hi again thuy there is a fee for process a stop payment onlin yourself i would honestli sug http t co tm01km5cst
630,bahamian bank hate me i am convinc after alllllll the deposit issu i had with commonwealth i decid to de http t co ub5f8zglm
631,cibc asset manag ha decreas it stake in suncor energi new su by 12 54 million a share price declin s http t co h8hqtg8ttc
633,a cibc studi found that retir plan is a low prioriti for canadian in 2019 http t co ubsf3jcswg via http t co pzqxssvuzq
634,just hid the cibc ad on twitter becaus those penguin are creepi af
635,enen in the scariest neighborhood in vancouv the servic is 100 hat off to your downtown main st branch wh http t co hsmdegk5zz
637,a new cibc poll find pay down debt is the number 1 financi prioriti for canadian head into 2019 the nint http t co wfdcd8mju7
638,debbiehellion thank you debbi we strive for custom satisfact and it s great to read such posit feedback http t co wfr3yqaoey
639,is thi your first time appli for a credit card cibc firstcaribbean s cash back visa credit card is the smart c http t co bhahwu0g6q
640,is thi your first time appli for a credit card cibc firstcaribbean s cash back visa credit card is the smart c http t co ncikgbslv
641,those friggin pangwang commerci ugh http t co 6by04wwthj
642,hi thi is rachana i studi in financ i am current work at cibc i love danc and i m a social medium addi http t co 3qc1ivgfob
643,skywork solut swk market perform rate reaffirm at cibc http t co m35kmugr8i stock
644,cibc it is for a tfsa stop and it s more than 5 day away when i go to custom servic onlin what should i http t co 51levlxmjt
645,click to read the latest cibc wood gundi isg daili market beat http t co kjpetpi83w
646,man arrest two hour after allegedli rob nanaimo bank cibc bank downtown rob saturday 41 year old arrest http t co yurpg5u7kh
647,hamilton is in chicago have you seen the play everyon ha been talk about here s your chanc don t miss yo http t co ezi89wosjp
648,if more compani gave good old fashion 100 percent custom satisfact like i have had for 13 year they a http t co blsi97w1nh
649,skywork solut swk rate reiter by cibc http t co yk6v1zgp9f
650,skywork solut swk rate reiter by cibc http t co nxeh4p6jaz
651,brunswick bc sharehold cibc world market ha decreas it stake a share price declin hd suppli hold http t co iq4sb6wepu
652,skywork solut inc downgrad by cibc oppenheim rank 58th to perform swk swk http t co bq2rn4qmz6
653,canadian are most concern about rise inflat the looni s weak and higher interest rate accord to http t co fgokq58kmk
654,jean gauthier manag director amp cio global fix incom at cibc asset manag discu interest rate mon http t co ei4huvjhjv
655,click to read the latest cibc wood gundi isg daili market beat http t co qmafbcgquz
656,click to read the latest cibc wood gundi isg daili market beat http t co fmboxmbfl8
657,is thi your first time appli for a credit card cibc firstcaribbean s cash back visa credit card is the smart c http t co b8lrbt1irt
658,is thi your first time appli for a credit card cibc firstcaribbean s cash back visa credit card is the smart c http t co nfrevbh7ho
659,click to read the latest cibc wood gundi isg daili market beat http t co z6jvtmibxi
660,pay down debt is the 1 goal for canadian say a new cibc poll that mark the ninth straight year in which deb http t co 6irhz7jjwa
661,pay down debt is the 1 goal for canadian say a new cibc poll that mark the ninth straight year in which deb http t co frkkfpsfd0
662,click to read the latest cibc wood gundi isg daili market beat http t co uebfd9lct
663,rt specincanada remind that specialistern is recruit for role with cibc do you identifi a someon on the autism spectrum or wit
665,the bank of canada will be make it latest interest rate decis wednesday with the likelihood of a hold steadi http t co lxesttqpdt
666,rt earn_ottawa congratul to everyon recogn a a topemploy in canada we are proud to have mani of these top organ
667,click to read the latest cibc wood gundi isg daili market beat http t co hwwto9c0cf
668,click to read the latest cibc wood gundi isg daili market beat http t co cvvog1ixtv
669,whoa yea note 100 will go one day http t co fau40u6zvv
670,click to read the latest cibc wood gundi isg daili market beat http t co plbuqhrjbn
671,rt uraniumsir for anyon want to see manipul first hand check out the trade that just occur on uex consecut 500 share
672,click to read the latest cibc wood gundi isg daili market beat http t co yv7ihbjsh6
673,pay down debt is biggest concern of canadian say cibc poll http t co rcd3hduumx
674,lkeesick on the mobil app you will select gt and select use a new card you will then enter the new debit car http t co divnqidavb
675,click to read the latest cibc wood gundi isg daili market beat http t co yluzz0kcgt
676,click to read the latest cibc wood gundi isg daili market beat http t co ruqqmtujs0
677,rt prjobsearch senior commun specialist busi develop commun cibc mellon toronto on mellon a canadian lead
678,cibc but now how do i save my card info on sign in app it keep put my old card
679,cibc but ye i regist again and then got the option to delet thi time
680,cibc ye i did that but after x 2 of your ppl off mayb you disconnect it lol
681,jean gauthier manag director amp cio global fix incom at cibc asset manag discu interest rate mon http t co n0ccxexzwc
682,markrmcqueen sound like the cibc might be put hi name on the new museum http t co ghge4rglz9
683,lkeesick hi lorrain to chat with u click on interac e transfer on your onlin bank there will be a butto http t co sl9tsousc5
684,click to read the latest cibc wood gundi isg daili market beat http t co 0cwkl9bp3x
685,the bank of canada will be make it latest interest rate decis wednesday with the likelihood of a hold steadi http t co l80zck2s0m
686,click to read the latest cibc wood gundi isg daili market beat http t co rkc5rps0lx
687,for anyon want to see manipul first hand check out the trade that just occur on uex consecut 5 http t co bt4fjl2xle
688,click to read the latest cibc wood gundi isg daili market beat http t co 551ma5l28o
689,congratul to everyon recogn a a topemploy in canada we are proud to have mani of these top organiz http t co 641dej6yrf
690,be smart know your pin by heart http t co ezesb6xowf
691,just over one quarter of canadian say pay down debt is the no 1 financi prioriti for them in 2019 the ninth http t co vjb7u29mtz
692,interest rate rise unlik thi week say cibc http t co r3y6z257y9
694,cibc and no live chat veri disappoint spent most of morn
696,cibc ok i got it but no help
697,sherefsabawypc cibc you ll make some kid veri happi with these toy great job
698,the bank of canada will be make it latest interest rate decis wednesday with the likelihood of a hold steadi http t co bgrgrpfnkx
699,rt leftytrad jeez let it go good to see cibc and anon load itg unload apha apha to http t co 8lhksdt7da
700,amberrecklezz good day notic your tweet pleas send u a dm with the detail so that we can help am
701,rt leftytrad jeez let it go good to see cibc and anon load itg unload apha apha to http t co 8lhksdt7da
702,rt leftytrad jeez let it go good to see cibc and anon load itg unload apha apha to http t co 8lhksdt7da
703,jeez let it go good to see cibc and anon load itg unload apha apha to http t co 8lhksdt7da
704,the tweet on thi twitter handl are for entertain purpos onli and they are not invest advic weed http t co 3h0xuplvsn
705,rt cibc get financi advic shouldn t make you miss the accept speech that s whi cibc advisor can meet on your schedul
706,cibc galileisinsight
707,jeff chapman our menlo park base cibc innov bank colleagu will be at the jpmorgan confer again th http t co sni30syjwo
708,cibc world market ha trim rio tinto plc rio posit by 551 718 market valuat declin a t amp t new t http t co nmsva9gtiq
709,senior commun specialist busi develop commun cibc mellon toronto on mellon a canadia http t co huelhd3y1i
710,jasonebussey1 that doesn t sound right jason i would love to look into that for you can you send u a dm with m http t co z5g2zppmim
711,help u keep your account info up to date in complianc with global financi regul cibc firstcaribbean is http t co rbxtueyoa0
712,help u keep your account inform up to date in complianc with global financi regul cibc firstcaribb http t co miq5cm4t3n
713,realli disappoint that cibc is refus to honour the aventura for busi travel credit they put in my account http t co ukgcvfgftt
714,registr for the dvastudentchalleng power by tableau and sponsor by cibc and deloitt is now open comp http t co hxlok4fvb8
715,the winner of our 12 busi of christma contest elain poulin the stitchin man toqu amp iphon http t co ohbmvo8cea
716,rt unlchemistri congratul to the power lab for publish one of the most popular paper in the last two year by metabolit htt
717,door are open for debt financ in the vc market say cvca chair amp cibc s mark usher and joshokan for sub http t co ki2zh8xm56
718,the bank of canada will be make it latest interest rate decis wednesday with the likelihood of a hold steadi http t co hdrnhdpnlu
719,janiemcginley hi jani we apolog that you had a bad experi when speak with u and i would like to tri http t co mpzskoebsm
720,cibc ha the worst custom servic ever just talk to a guy who said idk how to help you when i told him i m http t co eswbx1rjwf
721,bahama help u keep your account inform up to date in complianc with global financi regul cibc fi http t co c7jp3b7xc8
722,cayman it is import that your latest info is on file to meet regulatori standard visit cibc firstcaribbean http t co zxoaflvyz
723,b c interior lumber shipment to u s fell 20 yoy in q4 cibc capit market 1 07 19
724,interest rate hike not like thi week cibc http t co iwgpprr3cx
726,lkeesick hi lorrain if you are do it on your mobil app when you open the side menu scroll down and select http t co bnqqkx5fe
727,the amount of your down payment will determin whether you ll have a convent mortgag or a high ratio mortgag http t co pqdodxx8c0
728,cibc ok i tri no good guess i have to do on laptop im tri to send money to my other bank
729,free yourself of clutter wast and file time by sign up for free onlin statement via cibc firstcaribbean on http t co zk90c7s7bf
730,rt uwaterlooart hey uwaterlooart student love data and stori tell you could win in the data vizart student challeng run by
733,did you know cibc hire scammer to make prank wake up call to innoc victim who ve never been client world http t co ehsnsuifkd
734,lkeesick hi lorrain you can cancel autodeposit from your onlin bank from the left navig menu click i http t co aw9hn3kvit
735,rt khanrk159 give back to the commun lambtoncolleg toronto team cibc from scarborough district meet and greet new student
736,cibc how do i shut off autodeposit
737,free yourself of clutter wast and file time by sign up for free onlin statement via cibc firstcaribbean on http t co ogecelbhap
738,click to read the latest cibc wood gundi isg daili market beat http t co gqvrg40ut1
739,click to read the latest cibc wood gundi isg daili market beat http t co rrf1qzryyn
740,a new cibc poll find pay down debt is the number 1 financi prioriti for canadian head into 2019 the nint http t co 4r5lq7qfpc
741,rt 1039krock the hair boutiqu in the cibc build will remain close today
742,the hair boutiqu in the cibc build will remain close today
743,free yourself of clutter wast and file time by sign up for free onlin statement via cibc firstcaribbean on http t co borz1ntqdl
744,free yourself of clutter wast and file time by sign up for free onlin statement via cibc firstcaribbean on http t co 3oror5uoir
746,a http t co mefvwzgyx1 amzn market valu declin sharehold cadinha amp co ha decreas it stake by 332 33 http t co sgqwrallmh
747,interest rate rise unlik thi week say cibc http t co helawup6pk
748,shannipoo cibc_fcib thank for provid u with your feedback would you mind send u a dm so we could discu further sb
749,cibc begin coverag on catalyst bioscienc cbio http t co t52qntddaz
750,catalyst bioscienc cbio now cover by analyst at cibc http t co jfjpykarv
751,cibc_fcib i call your call centr they advis i can t do account jmd to account usd on weekend also whi http t co jaehdx7eno
753,thi week in the verschuren centr rbc cibc and td_canada will be on site to assist newli arriv student with http t co wmpzzkhbq4
