,tokens
1286,chrisconte79 cibc http t co um504bkq1n
1287,chubsluu cibc rbc been my ride or die sinc day 1
1289,anyon know a better bank than cibc
1290,rt sherryask 2018 in hack marriott hotel bell canada bank of montreal amp cibc s simplii financi facebook predict for 2
1291,ring in the new year with the smarter card appli for a cibc firstcaribbean chip amp pin and contactless card today http t co ns0batpud3
1292,ring in the new year with the smart card appli for a cibc firstcaribbean chip amp pin and contactless card today http t co cmxtytcx3l
1293,ring in the new year with the smarter card appli for a cibc firstcaribbean chip amp pin and contactless card today http t co u33jffforb
1294,one thing about cibc thi line is alway long
1295,senior investig high risk enhanc due dilig cibc toronto on on a mission to build the relationship f http t co olqywag48w
1296,2018 in hack marriott hotel bell canada bank of montreal amp cibc s simplii financi facebook predicti http t co z1pme8xq54
1297,rt itsbeemarri y0ur estimat3d wait tyme iz 40 m1nute cibc i m done with y all i ll put my money in a shoe box befor i use a bank ag
1298,y0ur estimat3d wait tyme iz 40 m1nute cibc i m done with y all i ll put my money in a shoe box befor i use a bank again
1299,buhrnick you re veri welcom nick shara
1300,itsbeemarri hi bee i m hope that your concern have been resolv if not pleas send u the detail a we d http t co qfryc6a51
1301,cibc okay thank you
1302,buhrnick hi nick your exist password would have been carri over to the new card automat if you attemp http t co hhufmvaoyo
1303,cibc the card wa gotten 2 week ago if that help a littl on time frame
1304,cibc uh oh
1305,_imsan_ hi there spot your tweet i d like to bring thi to the attent of the bank centr in order to en http t co 1okc6dwsd8
1306,cibc i have tri go to the forgotten password to chang it there but wa get the same stuff i did get a http t co xd28gkssul
1307,i m at cibc in etobicok ontario http t co 8q5aypn3nx
1308,meetabdul29786 it doe not includ the day you deposit the chequ and thi exclud holiday like new year day http t co fdgbdhacr
1309,cibc doe it includ the day when the chequ wa deposit
1310,cibc your interest rate are piti your fee and charg are outrag and for what to let me access my mone http t co oozhsbqxfu
1311,buhrnick hi nick i m sorri to see you are have an issu log in to your onlin bank to clarifi have you http t co orez8ewxir
1312,cibc i m have issu with the websit and onlin app everytim i go to enter my info in right to log in forgot http t co vvbfilnjbg
1313,terminalfoxx pleas use thi link http t co imanawnjua to book an appoint at your nearest bank centr http t co lx9aqc0do0
1315,terminalfoxx hi there we would love to look into altern account for you i welcom you to come in to one of http t co ts96m4lsn2
1316,cibc nahhhhh you guy are realli whack for thi 19 hour nineteen hour to process a etransf that need to be sent 19 hour ago
1317,alexandriawag hi alex gener student offer do need to be renew by provid proof of enrol in order t http t co t0id8g60p0
1318,meetabdul29786 hi abdullah a chequ will be clear on the 4th busi day at 11 00pm in the citi where your acc http t co tkmsh7bamt
1319,we will be serv up fresh pint and belli laugh all night it s comedi night at cibc grab a friend and head ove http t co o1m9ntak07
1320,nagatalockii thank for provid u with a screenshot can you pleas send u a privat messag with your full na http t co ftbbybnyqp
1321,tigersammi cibc the onli issu i m hesit to start switch to one without a branch is how inconsist the mail is here
1322,terminalfoxx cibc no physic branch but i use tangerin and simplii never had an issu with either scotiaban http t co oxzu0v3ccn
1323,anyon got suggest on a new bank cibc charg wayyyyy too much for a check account and i want someth with a physic branch
1324,cibc all section of the watch app give the same error http t co lgrv13trpq
1325,themasterhax hi steven the bank centr leader of the whitemud and 17th street locat is now awar of the is http t co ipogf1unx0
1326,hi cibc clear a certifi td_canada chequ is take liter 4 busi day which is annoy and doesn http t co g99hjayqkq
1327,cbcalert must be a serious slow day at cibc
1328,cayman time to pay for your insur or tax on your home appli for an easi cover revolv loan befor 31 oc http t co zlqlk9y0km
1329,my bank ha been take 100 from me everi month even though i have student account cibc what s good give me my money back
1330,the tweet on thi twitter handl are for entertain purpos onli and they are not invest advic weed http t co plctiiaq1w
1331,nagatalockii can you also let u know where you are experienc the error code on the app diana
1332,pay down debt is the 1 goal for canadian say a new cibc poll that mark the ninth straight year in which deb http t co eqfijljrkh
1333,heddleey hi sarah thi doesn t sound right pleas send me a dm with your postal code and phone number on file a http t co fbzroejp5
1334,nagatalockii i would like to investig further on the error you are experienc pleas send u a privat messa http t co u180ibppbi
1335,cibc onli bank that charg you fee when you fix their mistak buh bye cibc you re stuck in 2018
1336,randgold resourc gold upgrad at cibc http t co nhbpupoi8j
1337,ajadhao hi amol glad to learn that the app work for you i wa unabl to replic the issu on the browser on http t co jpj3clgczn
1338,irony_leg hi there thank so much for your feedback about our envelop free atm your busi is appreci an http t co oktr0vei6v
1339,dollar will weaken in 2019 say jeremi stretch at cibc currencyforecast fx http t co tte5qqkq3f
1340,missabl hi sarah pleas send me a dm with further detail about your experi i d like to look in to thi http t co 4uvqqdktwq
1341,barrick gold abx coverag initi at cibc http t co rsh39ksnyl stock
1342,cibc begin coverag on barrick gold abx http t co ugcv0vyitb
1343,cibc i wa abl to use app for e statement but not websit
1344,barrick gold corp reiter rate by cibc oppenheim rank 58th to sector outperform abx abx http t co 1fuhlkvrwp
1345,cibc the mobil app iphon is work the appl watch is get error 0001
1346,nagatalockii hi there our mobil app is current avail can you let u know if you are receiv an error co http t co wk1hj0guwc
1347,itsbeemarri hi bee i would love to look into thi for you can you pleas send u a dm with your full name phon http t co n0psyhtdln
1348,rt specincanada remind that specialistern is recruit for role with cibc do you identifi a someon on the autism spectrum or wit
1349,cibc are servic for appl watch down at present app is work on my iphon
1350,envelop le deposit at cibc thi morn freak me out right on for reduc wast cibc hope more bank follow rrr
1351,accord to a cibc poll more than 1 in 4 26 said that that pay down debt is their number one financi prio http t co lkn25mtba6
1352,i love how the bank think they can charg me for a servic they won t give me i don t think so cibc
1353,jv_ht there s a print shop in the cibc build on barrington
1354,a cibc mortgagespecialist like me is avail to answer your mortgag relat question 24 7 what are you wai http t co svnb4knvfj
1355,with interest rate rise mani canadian are priorit pay down their debt in 2019 accord to a cibc pol http t co f7addktuaq
1356,martini_tiyi thank happi new year sb
1357,cibc_fcib your custom servic is top
1358,checkphish hi there i can confirm that thi e mail wa not sent by cibc we have alreadi taken the necessari step http t co kyb9draian
1359,_damarioj you re welcom onc your card ha the cirru multilink symbol at the back you can use it at our abm sb
1360,drive thru atm machin at cibc http t co lgynvgb5ca via youtub
1361,i m go back to sleep when i wake up shit better be in line cibc is move like an uneduc pimp
1362,rt cvcacanada give back champion the final part of our seri on how canadian privat capit is give back to canadian commun
1363,_tajay _damarioj you would need to contact your bank to inquir about their schedul of charg sb
1364,cibc_fcib thank you
1365,_damarioj good morn ye you can use your ncb card at our abm see our locat below sb http t co xm8aw2rqtc
1366,if you have not seen hamilton run don t walk it wa amaz cibc theatr http t co odfqujiukx
1367,itsbeemarri cibc oh they scammin you the real gangster are corpor
1368,moso_jon cibc call them wait 30 min for them to tell me to wait it should send in a few min
1369,itsbeemarri cibc have you call them that pretti unusu for a bank not to help their custom cibc you have to respond
1370,moso_jon cibc i almost cuss the wrong peopl becaus of thi like i thought i wa be scam til i realiz http t co uail591wvm
1371,itsbeemarri cibc i suggest go with tangerin or td bank becaus that wack
1372,time to pay for your car insur or road tax appli for an easi cover revolv loan befor 31 octob 2019 and http t co 5wfy6p0eh7
1373,rohit_scott hi there we would love to assist you with thi can you pleas send u a dm with your full name phon http t co vuv80x5eqo
1374,what make it wors i m not get none of these deposit back but cibc is reimburs me for thi shit
1375,canadian nation railway cnr price target lower to c 118 00 at cibc http t co 9oekfuqj2m
1376,moso_jon cibc it should take a few moment for the etransf to send we re go on 15 hour
1377,itsbeemarri cibc lol if you complain in your white girl voic they ll be scare
1378,lash appoint gone hair appoint gone brow appoint gone thank to cibc bloodi bastard close my acc http t co cgpbqtszrq
1379,so becaus cibc isn t send peopl money i ve lost 2 appoint that were even harder to book to begin wit http t co ggznyv8xik
1380,kristinakemp hi kristina just reach out to you again to make sure that you were abl to connect with one of u http t co zzazv90g4h
1381,oh but you guy are so quick to take servic fee and the etransf is still pend 14 hour to send an etran http t co pcylnh1eau
1382,mrcarlrodg hi carl there is no fee for incom direct deposit pleas chat with u amp we can review thi sig http t co 8uxwl9exx
1383,tim horton amp cibc freebi free medium tea hot chocol coffe latt everi weekend use cibc visa card
1384,cibc world market corp ha cut it posit in merck amp co inc new mrk by 25 31 million a share rose http t co msr2xxd9oq
1385,merck amp co inc new mrk holder cibc world market corp decreas posit by 25 31 million a share valu rose http t co 7gavmzop0g
1386,cibc world market corp decreas it merck amp co inc new mrk posit by 25 31 million a valuat rose http t co kodmemcv5q
1387,sinc when doe cibc charg the client for direct deposit just look at me bank account and cibc ha deduct http t co mwqwzrqo25
1388,merck amp co inc new mrk share valu rose while cibc world market corp decreas by 25 31 million it stake http t co mykn9b6z8
1389,johnson amp johnson jnj sharehold cibc world market corp increas stake http t co ukfljgfl6n
1390,a johnson amp johnson jnj market valu rose cibc world market corp increas it hold by 15 52 million http t co bdvc5soldd
1391,cibc world market corp boost it johnson amp johnson jnj hold by 15 52 million http t co euur5bsqlv
1392,johnson amp johnson jnj posit ha lift by cibc world market corp http t co 1ukw58gvbl
1393,tim horton amp cibc freebi free medium tea hot chocol coffe latt everi weekend use cibc visa card
1394,bamfmoney hey just get into dividend stock my best two are cibc and canadian tire both seem solid to me ani other you recommend
1395,rt autismont look for a job specincanada can help they are current recruit for role at cibc http t co e134ecuzla
1396,phillippittman7 hamiltonmus broadwaychicago cibc miggstac09 kingcolbythe1st candacequarrel jamilajoy http t co bvuqtqqfhx
1397,cibc whi are you the onli bank that legit like to jerk peopl around first you cant repli to a dm you ask fo http t co oqfrutxojw
1400,rt clicktal find out the answer from brand such a cibc and ezcat in our cx_network on demand webinar about build loyalti in th
1401,fcftoequiti para eeuu lo m bajo son bnp cibc world market y frontier strategi grouo
1402,blackberri bb stock rate lower by cibc http t co vi5kytyi7
1403,blackberri bb stock rate lower by cibc http t co tkeuyag3go
1405,rt specincanada remind that specialistern is recruit for role with cibc do you identifi a someon on the autism spectrum or wit
1406,all wah gwan if i wa die and i wa suppos to use cibc to save my life mi ago dead
1407,i can t lie i realli am gon na feel sorri for the cibc repres that ha to deal with me tonight
1408,thank you cibc for 13 year of great servic much appreci http t co msltp5ueym
1409,rt cibc_pwm_u poorli execut estat plan can take an especi hard toll on blend famili we can help simplifi your famili wea
1410,rt cibc_pwm_u without a clearer pictur on the economi and fed investor sentiment will like remain skittish go into 2019 and valu
1411,ajaxstolenhom rcmpgrcpolic rcmpont commrrcmpgrc oppassoci opp_new oppcommission torontopolic http t co talgwakcii
1412,like my side nigga i m leav cibc in 2018 goodby
1413,ajaxstolenhom rcmpgrcpolic rcmpont commrrcmpgrc oppassoci opp_new oppcommission torontopolic http t co jqqbrm8vqo
1414,cibc better find someon to do my lash last minut sinc they don t want to send etransf
1415,sinc when doe it take 6 hour to send a etransf cibc
1416,r7f1 bmo anyth s better than cibc make me lose deposit and appoint thank guy
1417,cibc realli fuck me over and it s 2 day into the year scotia bank don t sound too bad tbh
1418,cibc pleas help i paid off my loan with your bank in august someon lost the chequ at your end money wa stil http t co tdwwa1dt26
1420,phillippittman7 hamiltonmus broadwaychicago cibc miggstac09 kingcolbythe1st candacequarrel jamilajoy http t co izaakv8iuq
1421,rt lydia_mclaren chlhockey cibc jbraz1517 mclaren_col dferg_98 ohlbattalion blazerhockey ohlhockey qmjhl thewhl hfxmoosehead
1422,hproskow your loyalti with u through the year is appreci helen can you clarifi if you are refer to you http t co vcre6eysss
1423,devynnkelli hi there a a cibc client you should expect noth le than the best possibl servic everi time y http t co he0z4otgdf
1424,thank the world wa wide enough for u to see the incred hamiltonmus broadwaychicago cibc http t co rsr7oyyqyz
1425,rt chlhockey the vaughnhockey chl goaltend of the week is canuck prospect miketendi of spitshockey with a pair of ohlhockey win
1426,chlhockey cibc jbraz1517 mclaren_col dferg_98 ohlbattalion blazerhockey ohlhockey qmjhl thewhl http t co nrhmhkflte
1427,maureenjohnson oooh ooh can i do cibc in chicago let s cover the whole hamilton circuit
1428,byrosenberg same thing happen here in the greater toronto if not worst rent a hous start at 2 to 3 tho http t co uaq49htztg
1431,jayjm92 i m happi to help jay avi
1432,cibc thank you
1433,tim horton amp cibc freebi free medium tea hot chocol coffe latt everi weekend use cibc visa card
1434,tim horton amp cibc freebi free medium tea hot chocol coffe latt everi weekend use cibc visa card
1435,themasterhax hi steven thank you for bring thi to our attent we take our client privaci veri seriousl http t co gzy1zlksnn
1436,rt specincanada remind that specialistern is recruit for role with cibc do you identifi a someon on the autism spectrum or wit
1437,rt autismont look for a job specincanada can help they are current recruit for role at cibc http t co e134ecuzla
1438,rt autismont look for a job specincanada can help they are current recruit for role at cibc http t co e134ecuzla
1439,rt stinghockey stingtv featur present by tourismlambton lcunningham66 catch up with teamcanada world junior head coach tim h
1440,cibc i m site at one of your bank and your client person info is at risk you will want to fix the privaci s http t co dut94lebpu
1441,what i don t get is how doe a phish scammer get the abil to buy a domain and setup http on it for cibc dash http t co 4wzjavccbv
1442,cm barclay announc chang to the cibc atla select mlp index http t co ej3ql7mx5d
1443,barclay announc chang to the cibc atla select mlp index http t co mqqkq4gheg
1444,without a clearer pictur on the economi and fed investor sentiment will like remain skittish go into 2019 a http t co qmtgiqgexf
1445,barclay announc chang to the cibc atla
1446,rt autismont look for a job specincanada can help they are current recruit for role at cibc http t co e134ecuzla
1447,ctv_powerplay cibc mr shenfeld ha over the year master the art of say absolut noth while look veri content with himself
1448,rt autismont look for a job specincanada can help they are current recruit for role at cibc http t co e134ecuzla
1449,look for a job specincanada can help they are current recruit for role at cibc http t co e134ecuzla
1450,tim horton amp cibc freebi free medium tea hot chocol coffe latt everi weekend use cibc visa card
1451,tim horton amp cibc freebi free medium tea hot chocol coffe latt everi weekend use cibc visa card
1453,what doe 2019 have in store for the canadian economi we caught up with cibc s averi shenfeld to get hi predicti http t co dafzjjphj
1455,director data scienc and machin learn treasuri analyt cibc toronto canada http t co e7rd4shlik
1456,anmoloberoi4 hi again anmol can you confirm whether you ve tri the forgot your password link to reset your o http t co lgr1vkiulk
1457,associ global infrastructur and power global invest bank calgari region alberta ca cibc http t co rwtdlxvkf7
1458,new f19000719 medic loc 900 block fennel av e ham upper gage av privat rd cn cibc unit r4 01 02 19 16 53
1459,toddkp0218 hey todd i m veri glad to hear that we were abl to resolv your concern in a time manner we stri http t co y8wgtqtwl
1460,econguyrosi you forgot the most import point 20x pe trail real number and 5 return is too low a return http t co f1vahpjazo
1461,tim horton amp cibc freebi free medium tea hot chocol coffe latt everi weekend use cibc visa card http t co iirqrywavm
1462,cibc live chat from the etransf screen definit help i wa immedi first in line and had my concern address
1463,stingtv featur present by tourismlambton lcunningham66 catch up with teamcanada world junior head coac http t co doydjgms0x
1465,a new cibc poll find pay down debt is the number 1 financi prioriti for canadian head into 2019 the nint http t co q8dodos9vx
1466,rt ramon complet my first internship a a design research and found my love for ux methodolog design sprint and system sup
1467,tim horton amp cibc freebi free medium tea hot chocol coffe latt everi weekend use cibc visa card http t co eotpqquvhi
1468,sarahgray33 hi sarah pleas send me a dm with the transact detail includ the date and amount of the tran http t co 8b4jymxsrk
1469,rt specincanada remind that specialistern is recruit for role with cibc do you identifi a someon on the autism spectrum or wit
1470,remind that specialistern is recruit for role with cibc do you identifi a someon on the autism spectrum http t co yycmd0dnj4
1471,cibc do you have a number i can call from oversea a i am current in england
1472,rt ramon complet my first internship a a design research and found my love for ux methodolog design sprint and system sup
1473,complet my first internship a a design research and found my love for ux methodolog design sprint and sy http t co 8rr27kojj9
1474,sarahgray33 hi sarah in thi case i kindli ask that you pleas visit a cibc bank centr so we can look in to t http t co o9tlhdvkyc
1475,jayjm92 thi is done at the discret of individu branch i d encourag you to get in touch with the branch d http t co 2krak5tzc0
1476,jayjm92 we d love to have you on board with u jay normal you can t open an account without be present in http t co arwlute2w7
1477,toddkp0218 hey todd there are no report outag with our interac e transfer servic howev we d like to loo http t co hil11a08fa
1478,markghanim hi mark i d like to get thi matter address for you in order for me to do so pleas send me a dm http t co i6ijkfhnqx
1480,cibc interac e transfer is not work they say to contact cibc but it s 140 minut queue wait time
1481,rt cafanet amaz day learn farmmgtupd feb 7 cityofredd w dobbiepet fao_alberta on oil amp ga water surfaceright fc
1482,natsprat3 murcut mattfrankkot fordnat nearli everi major economist on all side of the spectrum agre that r http t co awu2ickff7
1483,cibc might want to take a bucket while 45 hope santa bring him a wall
1484,cibc oh realli cool mayb tell your custom when you re actual close on jan 2 a well so we don t have to http t co nzkskso5i
1485,martythegirl you re not 4 30 should be enough to get readi and get to the bridg so if you want to meet at zak s http t co 1uqzxu4qg6
1486,nia_tri hi there i d like to learn more about your recent experi can you pleas send me a dm with more deta http t co zghu3hpmfm
1487,cibc hi i am move to canada in a few month i wonder if it could be possibl to open a save account befor http t co zcqhdlnacq
1488,cibc y can t i ever success order from thi card
1489,hahahahahahahahahaaaaa you if you attend comedi night at cibc tomorrow night come enjoy three hour of sta http t co kygjsrw5x8
1490,cibc so you guy have termin your agreement with plaid then
1491,mikenross hi mike i appreci your feedback on thi matter howev cibc doe not support the use of thi softw http t co iwo1svywuc
1492,help u keep your account info up to date in complianc with global financi regul cibc firstcaribbean is http t co i4lsekyt5r
1493,help u keep your account inform up to date in complianc with global financi regul cibc firstcaribb http t co 1n0efgzgnu
1494,cayman it is import that your latest info is on file to meet regulatori standard visit cibc firstcaribbean http t co qaqmkw9ek9
1495,cibc transferwis have told me to contact yourselv a it left their side and you will be abl to track thi use thi number
1496,sarahgray33 i would advis to contact them directli sinc we have no access on our end to track you can inquir w http t co pt7y9mue4p
1498,rt northernkingsca start 2019 off right huge thank to cibc for host our drivefordream student athlet at the raptor game ton
1499,cibc i have tri 3 time to contact u guy and each time after hold for an hour it disconnect or it say wait http t co qucn2zw9la
1500,obligatori shot of u with the marque befor see hamilton hamiltonchicago hamfam santalikeslili cibc th http t co lev2w4zar1
1501,cibc it s a refund from transferwis but i ve got a arn from them
1502,sarahgray33 hi sarah can you let u know what kind of refund you were tri to track i look forward to your repli diana
1503,joshuaor7 hi joshua i will repli shortli to your messag and chat with you through there diana
1504,cibc thank you
1505,cibc how can i get a refund track a it hasn t reach my bank i have an arn
1506,homebuyingtip take pictur and collect a much info on the properti a possibl http t co jux2rnsx7u
1507,a we consid where equiti are head thi year our invest team is focus on 4 key variabl read more in http t co j1beysx2v5
1508,cibc repli
1509,cibc hey are you guy have issu with plaid i ve been tri to connect my account to app that use it and http t co zfrqmdejf0
1510,joshuaor7 hi joshua i have receiv and respond to your direct messag shara
1511,themuudang hi there if you still haven t receiv a call back i d like to arrang for thi to be look into for http t co b2h3oxi0zq
1512,kristinakemp that doesn t sound right kristina can you pleas provid u with more detail on your interact http t co tzvjjjffza
1514,rt northernkingsca start 2019 off right huge thank to cibc for host our drivefordream student athlet at the raptor game ton
1515,85 of canadian say they need to save more money cibc poll http t co vqzrpjm5ew via bnn http t co xdgrq3jlz2
1516,the bank ha hung up on me three time im a littl annoy cibc
1517,realdylancarr you re welcom dylan thank you for your patienc dure thi time have a great day kristina
1518,alderlaneegg gasbasi hcg will crumbl and then i d be will to bet the cdn bank start quietli freak out http t co 2lar5tdamn
1519,cibc mobil web login seem to be work again thank you
1520,congratul armpetr http t co 7jsqbcgvin
1521,rt rob_berg happi new year and a new poll run by maru blue on maru voic canada from our friend cibc on what canadian prioriti a
1522,davidnelson333 thank for take the time to write back to u david i have forward your concern to the bankin http t co eb6ps2rkkd
1523,winter registr for the capit for kid student challeng present by cibc investor s edg is now open http t co kntslcvlcf
1524,new era for new barrick with potenti for 26 more upsid cibc say gold preciousmet stock http t co cbnqerz0o5
1525,g4g5j41n hi there thank for bring thi to our attent i can confirm that we ve alreadi taken the necessari http t co fu4p2tlscm
1526,the dryden polic servic report that the owner of the puppi left at cibc ha been identifi and the investigati http t co yuxsqauamh
1527,pay down debt is the 1 goal for canadian say a new cibc poll that mark the ninth straight year in which deb http t co ltwlk9jb0c
1529,episod 3 is the hardest one to do alreadi had to cut 3 big stori from the region opp cost in dryden kenora http t co cfpn3u42rl
1530,cibc the locat wa 1720 robson street
1532,a transalta tac stock price declin cibc world market trim it stake mk instrument mksi holder janney m http t co mr2jyl6d8x
1533,cibc world market boost stake in cdk global cdk by 885 980 janney montgomeri scott increas it bce new bce http t co a3s0r6hrjq
1534,sarahgray33 hi sarah your estat are avail on the second busi day of the month the statement should http t co am7w2ak1lz
1535,randgold resourc gold upgrad to outperform at cibc http t co gy3gr5mexn stock
1536,cibc hi when are e statement avail im still wait on my decemb one to come through thank
1537,the tweet on thi twitter handl are for entertain purpos onli and they are not invest advic weed http t co ppsydn5o7x
1538,doughgirl2121 if that doesn t work give u call at 1 800 465 2422 and we d love to assist you i apolog for th http t co ja4nbtrwr
1539,doughgirl2121 hi jennif i would love to look into thi for you can you pleas give me more detail a to where http t co gr2tgbupvu
