,tokens
1026,pixie_purfect hello sorri to hear about thi experi pleas send u a dm with locat detail so we could investig sb
1028,pixie_purfect cibc_fcib over to you kristina
1029,kristenvsmothra hi there thank you veri much for confirm these detail i ve forward your feedback to the ap http t co x0twjayqi
1030,usd cad toward 1 32 in q1 cibc http t co p8zbdpxonn http t co 5ayr3zwsim
1031,click to read the latest cibc wood gundi isg daili market beat http t co yluzz0kcgt
1032,weekendinspir there are no limit to what you can accomplish except the limit you place on your own think http t co vac2mcwher
1033,gilead scienc gild upgrad by cibc to outperform http t co reaaevitzx
1034,cibc brite nuh fuck their in branch atm ain t work and they want to charg me to withdraw fund
1035,gilead scienc gild upgrad by cibc to outperform http t co wphtjbsb6b
1036,you onli have until the end of the month to get your chariti bear inspir by jack amp lili pinchuk stop by your lo http t co cxkljhqzqm
1037,cibc look up at the touch screen button like that often result in touch the wrong one a well i wa tri http t co zvkjoj1w6f
1038,cibc old placentia rd mount pearl nl all the atm s that have been instal in thi area in the last sever ye http t co jqxksa1ok1
1039,rt ulmcent we spot mcconnellscholar nicol fielder 19 catch hamilton in chicago thi winter break mclife 4 365 cibc
1040,heathbridg capit manag ltd continu to hold hold in sierra wireless swir lilli eli amp co lli holder c http t co la2dnxkfmd
1041,today s report suggest that u s economi is on more solid foot than previous thought and stronger hire an http t co v7e968nguf
1042,readi to eat clean in 2019 pleas join emma larocqu a regist holist nutritionist amp certifi plant base http t co aosa0vn8eq
1043,click to read the latest cibc wood gundi isg daili market beat http t co fmboxmbfl8
1044,rt cmcdavid97 some extra bond time with my bro while help the yeg flight at their baggag pick up thank cibc amp torontopearson f
1045,click to read the latest cibc wood gundi isg daili market beat http t co plbuqhrjbn
1046,robertjglasco pleas use thi link http t co vcrhclsxad to reset your password if that doesn t work give u http t co 697txczmcm
1047,robertjglasco hi there our onlin bank is current up and run pleas give u more detail regard the http t co q9fgn2n4em
1048,cibc are you have issu with onlin bank
1049,rt fxstreetnew cad depreci not yet a risk to inflat cibc http t co x8vzlc5rkp canada usdcad bank
1050,rt fxstreetnew cad depreci not yet a risk to inflat cibc http t co x8vzlc5rkp canada usdcad bank
1051,cad depreci not yet a risk to inflat cibc http t co cwwx3ozhk1
1052,andrew quinn spent 15 year a head of mine invest bank for europ and africa at cibc then there s christ http t co gqyacfhlqt
1054,cad depreci not yet a risk to inflat cibc http t co x8vzlc5rkp canada usdcad bank
1055,cibc that a bit creepi diana ngl so ama just keep it to myself
1056,click to read the latest cibc wood gundi isg daili market beat http t co rkc5rps0lx
1057,cibc it look like an origin star trek set
1058,click to read the latest cibc wood gundi isg daili market beat http t co yv7ihbjsh6
1059,the_iraqi_ali hi ali i have spot your tweet and would like to share your experi with the bank centr p http t co j6w7vrf1wt
1060,shop and earn thi new year with your cibc firstcaribbean reward card http t co wcvhzwqcw3 http t co ctf54bknft
1061,pa13bak cibc_fcib i realli comment becaus there were peopl gloat becaus the dollar had gone down to 124 http t co eskf08ppdn
1062,shop and earn thi new year with your cibc firstcaribbean reward card http t co nxcklqeqol http t co jflphskcs7
1063,shop and earn thi new year with your cibc firstcaribbean reward card http t co sh8wckrefd http t co tlvakyjofm
1064,i love how me and the teller cibc are on a first name basi
1065,2lan hi allan i would be happi to get someon to reach out to you to get thi fix to do thi i ll need you to http t co bwlxrzwbrm
1066,cibc econom i ll get back to you later the week ahead http t co h18td8yx6k
1067,hafeezhussain10 hi hafeez i appreci you let me know if you would like to check on the statu of a refund http t co 7ezpiffyj5
1068,cibc hey krishan i had to hang up after 25 minut and didn t had my problem solv i wa tri to unblock my credit card
1069,2lan hi allan sorri to keep you wait were you abl to get your concern address if not pleas let me know http t co e3kjyhmehw
1070,cibc it wa an inconveni fee that the atm took my 25 00 and did not put it in my account
1071,crunchycarpet hi kerri i d like to look into thi for you could you provid u with the phone number that call you thank kristina
1072,hafeezhussain10 hi again hafeez thank for the inform can you pleas provid me with more inform abou http t co 1ourdm80ej
1073,jackfleming007 hi jack our telephon bank depart is open 24 7 unfortun we have been experienc hi http t co 2htinwqd9r
1074,canadian are most concern about rise inflat the looni s weak and higher interest rate accord to http t co alwhzqtt9b
1075,shop and earn thi new year with your cibc firstcaribbean reward card http t co ru3ngtcsp http t co ib3rgpilwz
1076,cibc 4 call from two number robo voic tell me i can get 0 int on visa is thi legit and annoy or some scammer
1077,barrick gold s abx sector outperform rate reaffirm at cibc http t co q5ve9x5oh3
1078,cibc thank you i wa just wonder if there wa an issu or the line were close i held for near 2 hour and gave up i ll call today
1079,barrick gold abx stock rate reaffirm by cibc http t co qtol3rksb
1080,click to read the latest cibc wood gundi isg daili market beat http t co 0cwkl9bp3x
1081,click to read the latest cibc wood gundi isg daili market beat http t co 551ma5l28o
1082,15 minut on the phone wait to talk to a cibc agent just to be put on hold again
1083,cibc i didnt get my 25 credit in my chequ account
1084,ivygordon3 cibc_fcib had usd at 130 1 chequ amp transfer at close of busi yesterday don t believ you get http t co oriy9wzwc9
1085,hafeezhussain10 hi hafeez sorri for the wait pleas let me know what you are call about and i would be happi http t co u1f45sytdp
1086,orhlarhlehkhan hi odubayo to make sure you get your credit card deliv to your new address pleas call u at http t co 6o8pb44x
1087,cibc i want to chang the address where my credit card would be deliv becaus i alreadi move out of the hous
1088,make updat for april s design build event infrastructur build publicprivatepartnership climatechang http t co qfkauaj6qg
1089,cibc whi is your wait time in onlin bank over 65 min
1090,click to read the latest cibc wood gundi isg daili market beat http t co kjpetpi83w
1091,click to read the latest cibc wood gundi isg daili market beat http t co d19mr3lifi
1092,rt goldiein604 bloomberg stori on cibc staffer fire for help client extract money from china vanr http t co oqetoyvkn2
1093,tonytroubl hi there which locat did you visit when thi happen apolog for ani inconveni diana
1094,freejimnow to send u a secur messag login use the full desktop site and select write to u on the left me http t co uh99ffzlji
1095,freejimnow hi jame i d like to review your account in detail and make sure that you ve got the right bank se http t co hazptatojc
1096,rt cafanet amaz day learn farmmgtupd feb 7 cityofredd w dobbiepet fao_alberta on oil amp ga water surfaceright fc
1097,anoth ridicul long line and it s onli 12 47pm come to the bank use to be fun lol cibc
1100,theeamandadm hello sorri to hear about your experi with u pleas send u a dm so we could assist sb
1104,get a free 25 credit if you use cibc s global money transfer servic onlin use my referr link http t co nsz3taotup
1105,click to read the latest cibc wood gundi isg daili market beat http t co cvvog1ixtv
1106,click to read the latest cibc wood gundi isg daili market beat http t co ruqqmtujs0
1107,panerabread you need to fix your payment system debit card from tdcanadatrust and cibc don t work time to eat elsewher
1108,click to read the latest cibc wood gundi isg daili market beat http t co uebfd9lct
1109,click to read the latest cibc wood gundi isg daili market beat http t co hwwto9c0cf
1110,farmadvisor feb 7 cityofredd learn from farmplan knitel on riskmitig on farm cibc hrialberta http t co twxi1obdkh
1112,we spot mcconnellscholar nicol fielder 19 catch hamilton in chicago thi winter break mclife 4 365 http t co ekylzusxss
1113,analog devic adi stock price declin while cibc world market cut stake math compani stake in boe co ba http t co q4dmgf7wzh
1114,cibc world market continu to hold posit in svb finl group sivb a pepsico pep share valu rose sharehold http t co f33kznzjgl
1115,canadian are most concern about rise inflat the looni s weak and higher interest rate accord to http t co b6xjsjwbg4
1116,hamilton is in chicago have you seen the play everyon ha been talk about here s your chanc don t miss yo http t co iqd6fbvao
1117,randgold resourc gold stock rate upgrad by cibc http t co 2gduytcz
1118,randgold resourc gold stock rate upgrad by cibc http t co 7vq7d2ih0z
1119,the tweet on thi twitter handl are for entertain purpos onli and they are not invest advic weed http t co mafcrtyrmq
1120,cibc monthli world market report januari 2019 http t co lnrfy8u2vw
1121,click to read the latest cibc wood gundi isg daili market beat http t co q7im0mtxpd
1122,applic for data day 2019 are due in 5 day with speaker from microsoft fundthrough cppib and cibc you do http t co lvzuprhgwq
1123,rt catastroph atikokan s td and cibc bank branch close last year onli a small rbc branch remain if william want to bank in p
1124,rt catastroph atikokan s td and cibc bank branch close last year onli a small rbc branch remain if william want to bank in p
1125,rt uwaterloocar do you love data and design check out the data vizart student challeng from tableau cibc and deloitt show off
1126,luc_bourassa_1 hi luc i d like to learn more about what s been happen kindli send me addit detail of yo http t co ir5dv5szlm
1127,atikokan s td and cibc bank branch close last year onli a small rbc branch remain if william want to bank http t co hnb2lnbkj0
1128,rt mhnonlin goldman sach buy nashvil commun for 73m http t co lc9l0y1v2w goldmansach cibc livelmc http t co g5jzq9xsyd
1129,do you love data and design check out the data vizart student challeng from tableau cibc and deloitt show http t co 7tqx6fnrsd
1130,cad dec job report a mix bag but noth that should move market much cibc http t co vhdlqc3en0
1131,catalyst bioscienc cbio now cover by cibc http t co li5krvdhnz stock
1132,rt cibc_fcib enjoy peac of mind while shop thi new year with your cibc firstcaribbean visa debit card http t co ye4hhn2ctg htt
1133,enjoy peac of mind while shop thi new year with your cibc firstcaribbean visa debit card http t co cw6reu2gi8
1134,enjoy peac of mind while shop thi new year with your cibc firstcaribbean visa debit card http t co inyzrtztyg
1135,enjoy peac of mind while shop thi new year with your cibc firstcaribbean visa debit card http t co ipy8jpmuc
1136,enjoy peac of mind while shop thi new year with your cibc firstcaribbean visa debit card http t co wztlrapsx1
1138,goldman sach buy nashvil commun for 73m http t co lc9l0y1v2w goldmansach cibc livelmc http t co g5jzq9xsyd
1139,lunararchivist hi lunar we receiv your privat messag and i will chat with you shortli through there diana
1140,g10 forecast of 2018 cibc see weaker dollar in 2019 via fxweek http t co 251wsgdl5c trade fx currenc http t co caz4kgwv7q
1141,catalystinc a key member of the canadiangenderandgoodgovernancealli http t co ksg2yjkpex share the ho http t co g0dz8birzf
1142,muadonellad hello sorri to hear about thi experi with u pleas send u a dm with the branch locat so we http t co nxxli3hyjn
1143,catalyst bioscienc inc initi coverag by cibc oppenheim rank 58th to outperform with 24pt cbio cbio http t co vabfp5hoax
1144,rt chicagoscholar great panel at today s career that make an impact event big thank to generalelectr rushmed civiltecheng
1145,canadian say pay down debt is their top financi prioriti in 2019 but what about save http t co iy8u5mjhg
1146,cibc_fcib you all realli need more teller i ve been in here foreverrrr even the elder folk complain
1147,queennes_ hello pleas visit our websit at http t co rh1uyatf1v to learn more about cibc firstcaribbean feel http t co gdg4o1kh6g
1148,cibc thank sb
1149,queennes_ cibc_fcib over to you nida
1150,bbd b cibc cut bombardi price target jan 4th 2018
1151,chroniclesofab hi there thi isn t the experi i want you to have with u i d like to pa your experi a http t co uciv1c4ofb
1152,jozba hello we notic your tweet amp would hate to see you go pleas send u a dm so we could discu your experi with u sb
1153,look for a cibc firstcaribbean branch or instant teller near you check out our locat page http t co imtck6s5fq
1154,look for a cibc firstcaribbean branch or instant teller near you check out our locat page http t co 1w1bvjxa9f
1155,look for a cibc firstcaribbean branch or instant teller near you check out our locat page http t co g6ypebykqc
1156,cibc thank sb
1157,hsg_xo hello pleas send u a dm so we could discu happi to assist sb
1158,edlobster2 hi ed spot your tweet if you receiv a text messag or email claim to be u pleas feel free t http t co e6i82vdzvi
1160,lylat_r hi layla i d be more than happi to get thi address for you which of our bank centr locat did you visit krishan
1161,look for a cibc firstcaribbean branch or instant teller near you check out our locat page http t co 9fypzlzqji
1162,wendyyxoxo_ sorri to hear about thi experi pleas feel free to messag u should you chang your mind sb
1163,cibc u labor market post a stellar perform in dec with both hire and wage top expect 312k http t co inbihgm1xu
1164,can ani chicago peopl help me is there ani park near the cibc theater or should i take a train in from the suburb
1166,davemugford hi dave i hope you are abl to get through to one of my colleagu at telephon bank if not plea http t co pvdhlpyvcc
1167,rt coachmotto what to do with a mistak recogn it admit it learn from it forget it dean smith
1168,cibc_fcib that s okay i m tire of send privat messag and e mail
1170,jackfleming007 hi jack i would love to assist you can you pleas send me a dm with your full name phone number http t co cbu8wjldnv
1171,it is 7 40am cibc i ve been on hold for 15 minut so far becaus of higher than normal call volum how can t http t co gmbkes11p5
1172,brittanyxxoxo pleas sign in to your onlin bank through the full site click on interac e transfer on the le http t co rxd2qaklow
1174,brittanyxxoxo hi brittani we would love to review thi with you through our chat channel the social medium team d http t co vdzxuf35sn
1175,juliankostiuk hi julian i have receiv and respond to your dm shara
1176,wendyyxoxo_ good morn wendi we are sorri to hear about your experi with u pleas send u a privat messa http t co iqqom7legv
1177,beberfect good morn amber we notic your tweet and would like to learn more in order to improv our servic http t co 65s1tkyytx
1178,lylat_r hi layla we would love to look into thi for you can you pleas let me know which bank centr you went into shara
1179,ajadhao awesom amol let u know if you have ani question shara
1180,consciousinv hi there pleas tri to sign in again and let u know if you are still experienc thi same error a http t co lskpkgvyui
1181,cibc world market ha cut it ub group ag ub stake by 637 995 market valu declin carmignac gestion holdin http t co qfkaldna0n
1182,vpd2fox15 thank for the info i receiv one from cibc who i do not deal with i repli to them scam report th http t co wqjxggajh
1184,which is better scotia bank or cibc
1185,canadian nation railway cnr price target cut to c 118 00 by analyst at cibc http t co hbnky8bcew
1186,is cibc phone custom servic down been hold for 90 minut cibc news1130 ctvvancouv georgiastraight
1187,indivisiblenet no deal never we have to hold everi member of the cibc that is hi famili account and mani http t co 7lqgb5gkbo
1188,chubsluu cibc sorri wa just suggest what i would do lol
1189,avtarg cibc he s dead but thank
1190,pcfinanci wadlukm pcf realli gone downhil sinc cibc fire them just close your account and go with a simplii http t co nmtgltkk8q
1192,rt specincanada remind that specialistern is recruit for role with cibc do you identifi a someon on the autism spectrum or wit
1193,can you imagin it s been 3 4 month now i m tri to chang my goddamn number on my cibc account to do onlin ban http t co ayo6lueljp
1194,quarry_rock pull up a chart of the cdn hous market i put on some lt put on cibc today it s the biggest para http t co od0w9chbnr
1195,lunararchivist cibc bank work so hard to make their custom s leav now they are open coffe shop to bri http t co mzeg3pnv5d
1196,rt specincanada remind that specialistern is recruit for role with cibc do you identifi a someon on the autism spectrum or wit
1198,sarahsuebeth hi sarah i m happi to read that my colleagu sean wa abl to provid you with a great bank exper http t co prqwx9bqdr
1199,cibc lunararchivist more modern and innov way mean we re go to bank in a way that mean i get an espr http t co l8en3kkrg
1200,theagenda hg_watson life in northern ontario no bu no rail amp now no bank the td amp cibc bank branch in a http t co yiu0ocfmlg
1201,lunararchivist i appreci your feedback mani client tell u they prefer to bank in more modern amp innov wa http t co ahidsrtrrp
1202,sarahsuebeth cibc oh ye sound good i ll be fine i ll tell that to the car rental compani too and the hotel
1203,mkeefeu cibc that wa word for word what i ask when they told me that
1204,cibc hellio i ve been charg and overdraft free when i never actual use my overdraft i need thi refund a http t co gtndxodeaq
1205,canadian bank is control by the big 5 td bank rbc bank of nova scotia bank of montreal cibc amp 4 of tho http t co ypwbopsdyg
1206,thank cibc anoth servic charg overdraft fee and interest fee wa deposit for decemb i want to know wh http t co vjlkd5cthb
1207,lylat_r cibc how doe a fuck bank not have cash what the fuck http t co vho98ioool
1208,hamiltonmus thank you so much to lucky_seat and cibc theater i won in the lotteri and wa abl to take my 15 http t co jdy3jrrm0n
1209,lylat_r cibc first air canada now cibc fuckaircanada and fuckcibc
1210,i just went to a local cibc branch and ask to withdraw cash in common bill that are current in circul i http t co rrqbslzkvi
1212,scotiabankhelp bighill44 bazinga that got their attent i ve been with cibc sinc i wa about 8 year ol http t co qrmj3ap3uo
1213,final dorki hamilton group selfi mla19 kidlitmla conferenceadjac cibc theatr http t co nxmm41djnm
1214,day of ticket hamilton cibc theatr http t co p8aalkardf
1215,anitasharma marketcal bnnbloomberg there is an error in perform of past pick cibc is not the 115 but 102 today
1216,cibc will tri
1217,hamilton cibc theatr broadwaychicago in chicago il w renbog http t co v9cldpx9yw
1218,chroniclesofab cibc just a few casual day in anoth countri with no money what s the big deal
1219,ctvnew mayb look into how canadian bank like cibc transfer money to iran not follow independ transm http t co 1w8ynuyboi
1220,and now the moment we ve been wait for cibc theatr http t co td7d8u6xwk
1221,sarahsuebeth cibc they re so bad left me strand at at an airport in anoth countri with no money tell me t http t co itktbdq325
1222,chubsluu cibc credit union also have no limit on fund guarante bank limit at 80 grand
1223,cibc aventura reward cibc aventura reward redempt 50 off on select item http t co bbgn5mtkof
1224,hsg_xo hi there pleas contact cibc_fcib on twitter for assist altern cibc firstcaribbean can reac http t co n0o5z1vmjn
1225,rt kmedeiroscibcma 17 realli posit quot to start your new year and ye your work day a well enjoy beyondmortgageswithmedeiro
1227,get your sh t togeth cibc
1229,new stratu report compar atbfinanci bmo cibc nationalbank rbc scotiabank td_canada http t co zvb8vcsjfu
1230,rt chicagoscholar great panel at today s career that make an impact event big thank to generalelectr rushmed civiltecheng
1231,chubsluu cibc td hand down
1232,theagenda hg_watson veri similar situat in northern bc http t co iceb9gcnw0
1233,is cibc have issu at the moment becaus all my money gone from my chequ account
1234,did you know cibc hire scammer to make prank wake up call to innoc victim who ve never been client world http t co ketnobzeo
1235,great panel at today s career that make an impact event big thank to generalelectr rushmed http t co l0fdqdzsz0
1236,sarahsuebeth cibc unbeliev poor servic you receiv almost make me want to chang bank just out of principl cibc
1237,2 cibc branch have close in my ride onlin bank with out afford broadband realli just anoth reason http t co wqpbiok9to
1238,bringduhruku hi there i d like to help out our onlin mobil bank is current avail let u know what http t co nacmq8nifi
1239,i could bitch about cibc for hour but let s just take a moment to appreci sean s outstand custom servic therealmvp
1240,cibc your onlin isnt work
1241,cibc what wrong with the app
1242,17 realli posit quot to start your new year and ye your work day a well enjoy http t co 6iyemqvvxw
1243,lunararchivist hi lunar our team is still avail to serv you we have modern some locat to offer a mo http t co 9onvwrtnwd
1244,dimcl2 kelans27 there wa also the motorcycl shop cibc bank branch insur compani and apollo pizza
1245,wow roll over instead of be real becaus imho we can all live togeth with the solut 2 pol http t co vvdyst5kak
1246,thank cibc mlsefound amp mapleleaf hockey4youth givinghockey theonlybarriershouldbetheboard nextgengan http t co czkxwxz2ik
1247,whi save for retir isn t a prioriti for canadian cibc poll finserv personalfin http t co 1xonfdykbm
1248,rt stratusresearch new stratu report compar atbfinanci bmo cibc nationalbank rbc scotiabank td_canada fccagricultur
1249,rt cibcfcibjm ring in the new year with the smart card appli for a cibc firstcaribbean chip amp pin and contactless card today http t
1250,tjd187 we love you too ty the best part of our job is you our client help you achiev your goal is a privi http t co yhsmckqm87
1251,thederekseguin td_canada i hear you 100 i m love cibc
1252,it may be a new year but not necessarili a happi one for all canadian a new cibc poll find pay down debt is http t co t8rnepooq5
1253,rt stratusresearch new stratu report compar atbfinanci bmo cibc nationalbank rbc scotiabank td_canada fccagricultur
1254,new stratu report compar atbfinanci bmo cibc nationalbank rbc scotiabank td_canada http t co pbjtzlwkqc
1255,creativelytir ezraklein financi servic doe not bank also there are lot of privat stakehold in c http t co yreqediwzd
1256,cibc sell 11 mil weed today these guy are realli confus lead bull turn lead bear potstock
1257,thewazzi hello we notic your tweet and would like to discu your concern further pleas sent u a dm with detail sb
1258,rt cibc_fcib unsur about strang transact on your account with cibc firstcaribbean mobil app you can freez your visa debit and cr
1259,unsur about strang transact on your account with cibc firstcaribbean mobil app you can freez your visa deb http t co zidyoi4mek
1260,unsur about strang transact on your account with cibc firstcaribbean mobil app you can freez your visa deb http t co vw270ncxqk
1261,unsur about strang transact on your account with cibc firstcaribbean mobil app you can freez your visa deb http t co zbr7zm3frr
1262,unsur about strang transact on your account with cibc firstcaribbean mobil app you can freez your visa deb http t co fobiwzwom
1263,alexandriawag hi alex we d be happi to discu your servic fee with you although we do not have access to your http t co wlsnb1qk3g
1264,chubsluu cibc big fan of tangerinebank can t beat their interest rate and lack of fee imo
1265,lol cibc alway grab my shirt with the money monitor http t co vlvrsl8mqf
1266,chubsluu cibc i like td but wait for there offer of ipad or money to switch royal bank also doe thi onc a year
1267,tconnors83 chubsluu cibc i have been work in the financi industri field for over 30 year now with a bank http t co b0n3bpuqio
1268,gilead scienc gild upgrad to outperform at cibc http t co gobouu79jz
1269,gilead scienc gild upgrad to outperform at cibc http t co pfbzaywo4x
1270,gilead scienc gild upgrad by cibc to outperform http t co yyy3qsl3sb stock
1271,gilead scienc inc upgrad by cibc oppenheim rank 58th to outperform with 85pt gild gild http t co nyq7xjnbr7
1272,wow if cibc wasn t move like brampton nigga my lash would be done right now and id be on my way to get my wig http t co asqz5j92ci
1273,cibc i wa charg over 80 more than onc and i would like a full refund
1274,chubsluu cibc liter ani credit union
1275,chubsluu xbraedenn cibc rbc coast capitol ha no fee i ve paid exactli 0 over the last 5 year after be s http t co d6026rf8hl
1276,scunliff hi stephen thank for bring thi phish site to our attent we re current take the necessar http t co wbztpbmvmn
1277,alexandriawag the bank centr can make these chang for you you can also give our telephon bank team a ca http t co oe2teqxf45
1278,alexandriawag hi alex in order to get your account switch back to a student account we would requir you to pr http t co yu3w6qhoxm
1279,ring in the new year with the smarter card appli for a cibc firstcaribbean chip amp pin and contactless card today http t co ebmygwlc4v
1280,chubsluu to do thi login use the full desktop site and select write to u on the left menu to get start p http t co crdntsgz0o
1281,chubsluu hi vivian we d certainli love the opportun to look into thi for you and ensur that you re situat http t co 4xoecg1dsh
1282,cibc i renew it in august and then in octob i start get servic charg and i contact my branch and they http t co mavpivsktj
1283,aworldtraveler_ hi there sorri to make you wait which of our bank centr did you visit i d like to pa you http t co w61hujshdk
1284,chubsluu cibc rbc i thinki my servic charg are like 20 buck max lol
1285,xbraedenn cibc rbc i ll look into it cibc just charg me 100 servic charg for the month lol
