,tokens
0,cibc pleas explain to me whi i want to remain an aventura card holder i call the travel concierg number to b http t co rweldf1pyv
1,rt cibclivelab we are pleas to announc cibc innov bank ha provid debt financ for callrubi in support of their acqui
2,cibc world market inc decreas hold in ing groep nv nyse ing fairfield current http t co 1n3vhlsa6e
4,your home is a valuabl asset use your equiti to help pay for major purchas and get more financi flexibl http t co i1admdabcn
5,both cibc and bmo ad at the chicago black hawk arena
6,final see thi and with 150 other lgbtq christian here for qconf19 cibc theatr http t co sbjr3lsagr
7,i check in at cibc theatr on yelp http t co gu2fiiuvhi
8,rt amedeotarnaucea cibc refund custom who were incorrectli charg possibl sinc 2003 news 1130 http t co rqymg07apx cibc
9,rt amedeotarnaucea cibc refund custom who were incorrectli charg possibl sinc 2003 news 1130 http t co rqymg07apx cibc
10,america the music midwest edit cibc theatr http t co grghbcb8xk
11,y know what city_whitehors should consid heat bu stop just the two transfer point stop at the westmark and cibc
12,rt thehallowedgold weed cgc eod net hous thi one is a beauti anon and cibc buy big 3 other cdn bank sell thi turn aro
13,thehallowedgold thi is great thank can you help me understand whi anon and cibc buy and the other three bi http t co sqsfcywwfz
14,rt markrmcqueen expensifi and tripact announc strateg partnership http t co xws6szpffw cibc innov bank openviewv
15,rt markrmcqueen cibc innov bank provid debt financ to rubi receptionist http t co d8pznedntr callrubi updatapartn
16,cibc still not receiv the cibc doubledoubl visa card free weekend coupon multipl call into the cibc and http t co hbaokcq9qh
17,rt thehallowedgold apha eod net hous much like weed thi look beauti to me cibc and anonym buy big seller are three ca
18,cibc ha state thi is a done deal that the bank will close in august offici from cibc will be in the commun in march
19,i m in terracebay tonight town is have resid come in and discu the closur of the cibc which wa announc http t co yx2mixeak7
20,rt thehallowedgold apha eod net hous much like weed thi look beauti to me cibc and anonym buy big seller are three ca
21,rt thehallowedgold weed cgc eod net hous thi one is a beauti anon and cibc buy big 3 other cdn bank sell thi turn aro
22,rt nationalpost mortgag growth will be flat or in low singl digit for forese futur cibc ceo http t co kjmeultju4 http t
23,apompliano cibc flat out told me to find anoth bank becaus they don t give credit card to peopl who never had http t co nkuz3mpa14
24,rt nofossilbank fossilbank too are support transcanada s coastalgaslink bmo jpmorgan scotiabank cibc deutschebank hsbc rb
25,apha eod net hous much like weed thi look beauti to me cibc and anonym buy big seller are three http t co ylzmlgdwdh
26,rt thehallowedgold weed cgc eod net hous thi one is a beauti anon and cibc buy big 3 other cdn bank sell thi turn aro
27,rt thehallowedgold weed cgc eod net hous thi one is a beauti anon and cibc buy big 3 other cdn bank sell thi turn aro
28,weed cgc eod net hous thi one is a beauti anon and cibc buy big 3 other cdn bank sell thi turn http t co v8eozjly8o
29,rt bobligertwood cibc what a funni thing to say in 2012 at 92 yr paulin wa wait for someon to come to her from cibc regard
30,cibc what a funni thing to say in 2012 at 92 yr paulin wa wait for someon to come to her from cibc regar http t co gyfez7ycyf
31,what a funni thing to say in 2012 at 92 yr paulin wa look for someon to come to her from cibc regard t http t co cry4yxx9sc
32,mortgag growth will be low or flat thi year cibc ceo http t co ez91u2kilo flipping4profit preigcanada
33,so cibc show me an offer one i m actual interest in take but after about 3 login i can t just snooz http t co meyekailcg
34,shoutout to cibc for their sponsorship toward our annual dairi trip qcdairytrip2019 http t co r6rmpeunnv
35,rt chicagolandcmbr applic are now open for the 50 000 tyreeaward the chamber mesirowfin amp cibc present the award to a small
36,applic are now open for the 50 000 tyreeaward the chamber mesirowfin amp cibc present the award to a smal http t co wuecb9jauu
37,analyst agil digit sale cibc toronto on social and own channel leverag the cross function team http t co gvy0mqz2ni
38,cibc ceo expect flat to low singl digit mortgag growth thi year http t co nuryj2czx5 via cdnbiz cibc canada realest
39,cibc initi coverag on carguru carg http t co kmcxlgybfx stock
40,wendi wen lift to outperform at cibc http t co 8qamq7m8a3 stock
41,a new cibc poll find pay down debt is the number 1 financi prioriti for canadian head into 2019 the nint http t co gxy5rcc9dm
42,cibc upgrad wendi wen to outperform http t co 7sox8tyfmn
43,carguru carg coverag initi by analyst at cibc http t co pha00rqchi
44,carguru carg coverag initi by analyst at cibc http t co i1h61wrrqc
45,carguru carg now cover by analyst at cibc http t co uifmobyzf
46,click to read the latest cibc wood gundi isg daili market beat http t co k3ytccqns7
47,mortgag growth will be flat or in low singl digit for forese futur cibc ceo financi post http t co aodq9ivazk
48,skip trace agent cibc vancouv bc social medium platform phone directori and bank system to gather a m http t co tdimw99s0
49,rt raptorsdevote i m team up with cibc later thi month for two first time homebuy advic seminar one locat at yong york mill
50,proud to be work with anoth great market lead compani cibc innov bank invest in rubi receptioni http t co 7qdwjvxm2
51,wendi amp 39 s co the upgrad by cibc oppenheim rank 58th to outperform with 20pt wen wen http t co vbh8lu3tr5
52,carguru inc initi coverag by cibc oppenheim rank 58th to outperform with 42pt carg carg http t co yacpparpi0
53,other than joshua tree we saw all of these spot but stay in a privat vrbo home we also did bombay beach and http t co hrgen59zxt
54,rt raptorsdevote i m team up with cibc later thi month for two first time homebuy advic seminar one locat at yong york mill
55,jess_cor hi there pleas send me a dm with further detail about your experi i am happi to forward thi matt http t co uyykvwdnru
56,i m team up with cibc later thi month for two first time homebuy advic seminar one locat at yong york m http t co d5llhbdgwx
57,i m team up with cibc later thi month for two first time homebuy advic seminar one locat at yong york m http t co xcu5abyfxv
58,exari name a clm leader in the forrest wave http t co 954x7so9yf cibc innov bank boston growthcapit
59,what theme will our investmentteam be follow a we head into 2019 find out in the latest edit of the fina http t co uqzjh7rntq
60,expensifi and tripact announc strateg partnership http t co xws6szpffw cibc innov bank openviewventur growthcapit
61,no wonder canadian can t afford home if penguin are take up all the space http t co xhvfugqsli
62,jkerby_88 hi i can confirm that the chat icon appear to be avail at thi moment it is also on the interac http t co c978ctlbdj
63,rt dbcurren cibc even 1 more boc hike would be neg for the front end of yieldcurv and along with an oil price recoveri allow f
64,simpliifin hi there i ve just roll up a bunch of my loos chang and would like to deposit it the nearbi cibc http t co dfvrln1m29
65,cibc so realli i wait my turn on hold for long period of time and then request to move onto the survey onli to http t co g1vlamjzcw
66,cibc i know i click on onlin bank
67,jkerby_88 hi again the chat option is onli access through onlin and not mobil bank at thi time the i http t co 72pvzivh0g
68,bmo cibc provid 80 million loan to canopi growth affili pot compani pharmhous financi http t co tug2dydnkf cannabi
69,cibc i don t see chat option
70,cibc i m tri visa check out amp i m use autofil on my iphon
71,jkerby_88 hi there pleas ensur that the inform you enter on the merchant websit match exactli with what http t co vojbuytgqv
72,mortgag growth will be flat for forese futur financialpost http t co hd3ml0vv6x canadianrealest http t co kltl3w594i
73,cibc i got ta ask am i the onli 1 who think the open 2 second the one penguin ha been shot amp is bleed e http t co ghoh1jdnyt
75,cibc firstcaribbean s onlin and mobil bank let you pay bill check your reward transfer fund and more http t co 9uhj6fsrb8
76,cibc firstcaribbean s onlin and mobil bank let you pay bill check your reward transfer fund and more http t co t7xxh524qr
77,mortgag growth will be flat or in low singl digit for forese futur cibc ceo http t co qhrxmsyqpl
79,the_xaqeri hi xaqeri are you have troubl access onlin bank if so you can tri to reset your password http t co 0nys6ssmgz
80,cibc can t you pleas help now i am unabl to call you at thi time
81,we are pleas to announc cibc innov bank ha provid debt financ for callrubi in support of their http t co mpvdxgx4em
82,jkerby_88 hi there pleas give u a call at 1 800 465 2422 and we ll be happi to look into thi for you nida
83,rt dbcurren cibc even 1 more boc hike would be neg for the front end of yieldcurv and along with an oil price recoveri allow f
84,cibc even 1 more boc hike would be neg for the front end of yieldcurv and along with an oil price recov http t co 3b61ixpwkg
85,boc statement wa more hawkish than market price cibc http t co xlympwdoil
86,cibc innov bank provid debt financ to rubi receptionist http t co d8pznedntr callrubi http t co e2mhdiarwf
87,hey cibc do you have a work around for peopl that get lock out of their account that also live in a remot lo http t co xaya3d9qjh
88,adidashockey my visa debit card cibc wa declin on the nhl shop websit whi
89,rt nhlblackhawk stay warm never look so cool thank to cibc the first 10 000 fan at tonight s game will take home thi blackh
91,click to read the latest cibc wood gundi isg daili market beat http t co 551ma5l28o
92,flynn95 interest perspect from both side here http t co ai49k2nixi
93,cibc fomc member walk a fine line last meet rais rate at a time when u stock index were plung http t co yjec2i6reh
95,rt dorkdragoon dear cibc i don t realli know much about your compani but your advertis with the penguin wa enjoy to watch
96,nhl_shop my visa debit card wa declin on your site whi cibc
97,jessebarfield29 i might be imagin thi but do you rememb cibc put out poster of the jay in the late 8 http t co nwjb0mfyrd
98,rt jfberk bmo and cibc provid an 80 million loan to pharmhous a joint ventur own in part by canopi river it s a sign that cana
99,bmo and cibc provid an 80 million loan to pharmhous a joint ventur own in part by canopi river it s a sig http t co 4gaploacci
100,boc statement wa more hawkish than market price cibc http t co spz0p9zzwq
101,bonavista energi bnp pt lower to c 1 55 at cibc http t co kxittq6kx
102,boc statement wa more hawkish than market price cibc http t co occ5atf4gt
103,rt tanyavanb cibc averi shenfeld reinforc the degre to which the economi is chang and lean to technolog the futureofwork
104,st0ckm0nster questrad happen with all of them last day of octob a friday no le cibc investor s edg wa http t co yn4lptwnyw
107,rt cmpmagazin the head of canadian imperi bank of commerc cibc said that the countri s mortgag industri will plateau in the near t
108,poll say canadian are unsur about rrsp and don t ask let s talk rrspseason brad cohen f55f com http t co xmlvjcegir
109,kdmadan hi again karan the social medium team doesn t have access to your account through twitter for further a http t co wyfco0cgiu
110,our card secur control allow you to receiv an in app notif a soon a a transact is made use your http t co vspr89gmni
111,our card secur control allow you to receiv an in app notif a soon a a transact is made use your http t co 1ffeevhuz7
112,ginaemily_ hi there thank for share your feedback we re happi to know that you re happi if you ever need http t co r9rshqi0az
113,cibc okay i will be clear i never want it it doesn t make sens that for a cad 7 overlimit i had to pay cad http t co pyg6zauvtw
114,cad boc taken itself out of hike game but statement wa more hawkish than market price cibc http t co 29wtamldji
115,apompliano pretti all canadian bank they block your account if u r buy crypto rbc tdbank_u cibc scotiabank
116,jillmacintyr i love my cibc advantag visa they have great custom servic free account for student and it g http t co f1mtq2as9
117,mortgag growth will be flat or in low singl digit for forese futur cibc ceo http t co dew9pzmdqq via http t co 5mmblaknp8
118,mortgag growth will be low or flat thi year cibc cbc http t co 7aokuwv0zt realest
119,your home is a valuabl asset use your equiti to help pay for major purchas and get more financi flexibl http t co 3ky9up2zbk
120,break news cibc innov bank invest in rubi receptionist http t co 8wncfh3auy http t co 2fx3pwwplh
121,cibc firstcaribbean s onlin and mobil bank let you pay bill check your reward transfer fund and more http t co ewotsbvhej
122,cibc firstcaribbean s onlin and mobil bank let you pay bill check your reward transfer fund and more http t co uz6odwxout
124,rt mortgageproscan reread what he said in hi speech to our nation mortgag confer in octob cibc s benjamin tal sure seem to
125,mortgag growth to be flat to low singl digit in 2019 cibc s dodig http t co m4qhnz7dzu
126,cibc head see flat mortgag growth in the forese futur http t co xq5p12ocf4
127,cibc head see flat mortgag growth in the forese futur http t co kilum0y2n3
128,dayzero5 cibc that is basic anti fraud then next week you cri they didn t stop it cibc is crypto friendli one of the few
129,rt weed_investor big bank see the potenti even if the profit will onli be seen in futur year they will be huge cannabi weed
131,the head of canadian imperi bank of commerc cibc said that the countri s mortgag industri will plateau in the http t co npf1iwguzj
132,i m at cibc in vancouv bc http t co ymftktvig8
134,guin asset manag ltd cut enbridg enb stake by 320 000 facebook fb holder cibc asset manag ha tr http t co ovqpaunjba
135,want to learn more about money drop by cibc hall to meet with the team to learn some help tip to navig yo http t co chve8rqwn1
136,jean gauthier manag director amp cio global fix incom at cibc asset manag discu interest rate mon http t co mvtmq6iqyp
137,i have an account with bmo cibc and tangerin the custom servic is the worst at bmo by a mile especi t http t co gyyjb7x9mt
138,a copart cprt stock valu declin cibc world market ha increas by 635 766 it hold a intel intc stoc http t co b6ipeayg4l
139,gran tierra energi gte sharehold cibc asset manag ha rais posit state treasur state of michigan in http t co akkntshprg
140,midweekmotiv take a leap of faith and begin thi wondrou new year by believ sarah ban breathnach http t co lacu3s3ey2
141,the tweet on thi twitter handl are for entertain purpos onli and they are not invest advic weed http t co 0ngzwkyla7
142,rt tanyavanb cibc averi shenfeld reinforc the degre to which the economi is chang and lean to technolog the futureofwork
143,maxar technolog maxr neutral rate reaffirm at cibc http t co dhcfdkjmkf
144,maxar technolog maxr neutral rate reaffirm at cibc http t co iull73eepq
145,rt msucampusev the game of life irl with the mcmaster student success centr team learn about budget set goal and transiti
146,rt nationalpost mortgag growth will be flat or in low singl digit for forese futur cibc ceo http t co kjmeultju4 http t
147,maxar technolog maxr neutral rate reaffirm at cibc http t co llujaptkg0
148,rt nationalpost mortgag growth will be flat or in low singl digit for forese futur cibc ceo http t co kjmeultju4 http t
149,mortgag growth will be flat or in low singl digit for forese futur cibc ceo http t co z3wgstirl
150,maxar technolog maxr given neutral rate at cibc http t co lnjp1haovn stock
151,mortgag growth will be flat or in low singl digit for forese futur cibc ceo http t co kjmeultju4 http t co yo6et68wpb
152,mortgag growth will be flat or in low singl digit for forese futur cibc ceo http t co ufvrrkios1 http t co swj8qik35n
153,mortgag growth will be flat or in low singl digit for forese futur cibc ceo http t co itoxycekmd http t co s5awa18rcg
154,victor dodig say the potenti for mortgag growth to turn neg will hing on whether the canadian hous mar http t co l0d0drh0z8
155,weed net hous atm cibc amp anon lead buyer http t co aak9xnhkzx
156,we re expand in canada join the best tech and financi industri leader in toronto our digit video netwo http t co fsrv07chhg
157,toronto can t build offic tower fast enough one of the new cibc build set to open in 2020 and is alreadi http t co p032x1cd6c
158,mortgag growth will be low or flat thi year cibc ceo cbc news http t co ykfmltgdhd
159,more from cibc on the boc a we expect the rate messag wasn t that they were done for good but rather that http t co ksqkdpwz3i
160,the melisizw brother made a huge bang on the intern music scene after their rendit of the jackson 5 s http t co mmkxiovmqo
161,kdmadan thi is done to provid some flexibl for cardhold who may be get close to their limit reduc http t co x9jiisacol
162,kdmadan karan credit card do not have overdraft protect in an effort to ensur you are not inconvenienc c http t co katmx5sckb
163,cibc see that s the thing i never sign up for the overdraft protect
164,toronto s cibcsquar offic tower complex bring larg elev screen in 2020 captiv s curat digita http t co vpi7isamy6
165,rt dbcurren cibc the bank of canada ha taken itself out of the rate hike game and it messag today suggest that it isn t quit a s
166,kdmadan balanc and avail credit inform is alway avail through cibc telephon bank mobil bankin http t co umtwzxie7i
167,kdmadan client have control over how much they spend on their credit card and need never pay an overlimit fee unl http t co pyvfgfynd6
168,kdmadan hi karan an overlimit fee is similar to overdraft protect on your bank account if it s use you are charg a fee 1 3 nida
169,cibc the bank of canada ha taken itself out of the rate hike game and it messag today suggest that it isn t http t co fowq0dzclm
170,the head of canadian imperi bank of commerc cibc said that the countri s mortgag industri will plateau in the http t co 72fgrbltkl
171,look for a cibc firstcaribbean branch or instant teller near you check out our locat page http t co bn7hlbyih2
172,look for a cibc firstcaribbean branch or instant teller near you check out our locat page http t co yyezrgny6a
174,cibc overdraft on credit card with out custom consent if a custom need credit they will request for the same
175,cibc worst custom servic never respond to email
176,cibc nida buy bitcoin cibc is hopeless
177,in the spotlight today is cibc investor s edg learn more about their focu on educ content young investor http t co vci4sskwzd
178,dayzero5 hi there spot your tweet is there someth i can help you with nida
179,rt prestocard 7uliovalencia morn j valencia we can understand the inconveni thi ha caus you cibc ha chosen not to have
180,littelfus lfu stock rate upgrad by cibc http t co fo5ysesmp7
181,honeywel intern s hon market perform rate reaffirm at cibc http t co mtrta4lhgx
182,cibc reaffirm market perform rate for regal beloit rbc http t co seeqdgplj7
183,rt ottawamortgag mortgag growth thi year will be low or flat thi year cibc ceo http t co tfj0qeebyu
184,littelfus lfu upgrad to outperform by cibc http t co dlmayckial
185,fifeyeno hi there i d be happi to have your concern look into pleas send me a dm with detail of your concer http t co c8qpqf5lbo
186,apompliano hsbc when sign up for a bank account they forc me to watch a tutori with a quiz at the end and http t co 1mlvbeebvw
187,regal beloit s rbc market perform rate reaffirm at cibc http t co uiyrgxfgfh
189,franchcraciun hi there i d like to know more about what s make you feel thi way pleas send me a dm with addi http t co qrchpjbt9u
190,click to read the latest cibc wood gundi isg daili market beat http t co 2qyghyue26
191,look for a cibc firstcaribbean branch or instant teller near you check out our locat page http t co rc2o2mash5
192,look for a cibc firstcaribbean branch or instant teller near you check out our locat page http t co fwxkqyctu2
193,man hous of fun won t instal there s no room on the tablet i m about to delet cibc
194,a canadian natl ry co cni market valu declin sharehold cibc world market inc ha trim hold http t co pssr5n2dbj
195,enbridg inc enb sharehold cibc world market inc ha increas posit by 581 49 million http t co tiykkuzwag
196,mosaic co mo cibc cut price target to 34 from 37 to reflect increas concern of a softer phosphat mark http t co icie1usfxz
197,tanyavanb cibc cpa_ontario whi is it ok to have all white peopl and onli one woman on that panel
198,cibc head see flat mortgag growth in the forese futur http t co uyighnv9y8
199,custom servic repres cibc powel river bc on a mission to build the relationship focus bank of th http t co yn6rbfeuqk
200,cibc averi shenfeld reinforc the degre to which the economi is chang and lean to technolog the http t co q9tpvfmk6g
201,rt msu_mcmast it s time to play the game of life but thi time in real life play a part in thi journey a you learn more about gett
202,acciotiffani hi tiff a long a you are a full time student you may be elig for our smart for student bank a http t co f0vminwpuw
203,cibc hous start provid some good news for the canadian economi thi morn a mild winter in much of the http t co 0dv9dofxea
204,rt 7uliovalencia prestocard are you still not accept onlin payment from cibc one of your agent rude advis me to take it up wi
205,rt prestocard 7uliovalencia morn j valencia we can understand the inconveni thi ha caus you cibc ha chosen not to have
206,trustsalehlaw hi cherif i d love to get you assist with redeem your aventura point in order for me to do http t co 99pcfbbzpt
207,rt marnituttl it should give u all paus when the brand be promot come first on fundrais promot bell let talk cibc run
208,it should give u all paus when the brand be promot come first on fundrais promot bell let talk c http t co bqjq9eqooi
209,the game of life irl with the mcmaster student success centr team learn about budget set goal and tran http t co 3bjgdngt5c
210,rt weed_investor big bank see the potenti even if the profit will onli be seen in futur year they will be huge cannabi weed
211,rt nofossilbank fossilbank too are support transcanada s coastalgaslink bmo jpmorgan scotiabank cibc http t co jn5yb57jrp
213,it s time to play the game of life but thi time in real life play a part in thi journey a you learn more abou http t co mtlp3oln7k
214,manag bank centr cibc edmonton ab on a mission to build the relationship focus bank of the futur an http t co 0l8lqaiztd
215,rt 7uliovalencia prestocard are you still not accept onlin payment from cibc one of your agent rude advis me to take it up wi
216,bmo cibc provid 80 million loan to canopi growth affili pot compani beckdex weedwatch acb t apha t http t co gdp9w0zmkm
218,the_woodi owning_mohowni questrad cibc
219,click to read the latest cibc wood gundi isg daili market beat http t co rrf1qzryyn
220,click to read the latest cibc wood gundi isg daili market beat http t co gqvrg40ut1
221,nolybam thank for reach out to u noell were you tri to send your messag through our secur messag http t co r4gronvj4p
222,alderlaneegg burri in between the headlin http t co stvfnsh7sb think is fa s i talk to say same amount of http t co cyvkwdla1
223,rt nofossilbank fossilbank too are support transcanada s coastalgaslink bmo jpmorgan scotiabank cibc deutschebank hsbc rb
224,rt nofossilbank fossilbank too are support transcanada s coastalgaslink bmo jpmorgan scotiabank cibc deutschebank hsbc rb
225,our card secur control allow you to receiv an in app notif a soon a a transact is made use your http t co 8xqzhhpgvt
226,fossilbank too are support transcanada s coastalgaslink bmo jpmorgan scotiabank cibc deutschebank http t co jru56c3arc
227,skywork solut swk stock rate reaffirm by cibc http t co sb8akswxsd
228,financi career start here http t co vcmmzrk7yo cibc head see flat mortgag growth in the forese futur http t co xwwwlkmzke
229,the bank loan is one of the largest provid to a privat compani in the cannabi industri by top tier bank http t co ttvpj9pxwo
232,7uliovalencia morn j valencia we can understand the inconveni thi ha caus you cibc ha chosen not http t co 1pa55ugljc
233,my poor debit card i m gon na have to go to cibc to chang my debit card to unlimit transact becaus i don t http t co hsudg9gokx
235,rt smfehir trudeaunom cibc expect mortgag growth for the next year to be in low singl digit go jr go
236,sr product applic support analyst java j2ee web servic git cibc toronto on on a mission to buil http t co knud0zvlnp
237,mobil mortgag advisor north shore cibc laval qc you ll be do you ll leverag your mortgag experi t http t co tvzaqt9fjp
238,sr product applic support analyst java j2ee web servic git cibc toronto on web servic xml s http t co uevpjamoyp
239,bmo cibc provid 80 million loan to canopi growth affili pot compani pharmhous http t co ulcwi2osxi
240,mortgag growth thi year will be low or flat thi year cibc ceo http t co ctb0pxnhtt http t co rgakhzsxxc
241,i ve just post a new blog cibc head see flat mortgag growth in the forese futur http t co p4a1lwuaat
242,i share import issu with cibc news still not get what make them to not work on it pleas help citizen
244,cibc head see flat mortgag growth in the forese futur http t co rzgfm7vpco via mortgagebrokernew
245,cibc head see flat mortgag growth in the forese futur http t co pablx0eemn
246,rt weed_investor big bank see the potenti even if the profit will onli be seen in futur year they will be huge cannabi weed
249,mortgag growth thi year will be low or flat thi year cibc ceo cbc news http t co qvqdk8jo8b
250,rt globeandmail cibc chief expect mortgag growth to be flat or in the low singl digit in 2019 http t co f4xmh57oqg globebusi
251,rt michaelbabad a day of reckon is come for justin trudeau s liber govern cibc subscrib http t co rrjgoeuyqi http
252,cibc broke a for fundrais
254,cibc work with rbc and i do the same
